ID,Risk Type,Short Description,Long Description,Risk Trigger,Current Status,Probability,Impact,Risk Score,Mitigation Relevant,Mitigation Options,Mitigation Cost,Identified By,Identified Date,Assigned To,Assignation Date,Remarks
RR-01,Resources,Alignment of QA,No QA has been assigned yet,Development will be over by mid next week. We need test cases preparation until then.,Active,4,9,36,Yes,Allocation of a QA minimum for half day,,Samarth,2026-01-01,Siddharth,2026-01-03,
RR-02,Delivery Timeline,Frequent requirement changes,"Module and framework structure has changed multiple times (32 to 27 frameworks, modules restructured). New frameworks introduced, mapping changes, field/tab changes post-discussion. This causes redevelopment and timeline slips. Update (May 2026): Module list now at 11 modules / 27 frameworks per client restructuring.",During delivery milestones when scope changes are requested,Active,5,8,40,Yes,Freeze requirements per sprint. Use signed Solution Document as baseline. Any changes go through formal change request process.,Included in sprint,Samarth Paul (PM),2026-01-03,Samarth Paul,2026-05-20,Reduced probability from 6 to 5 as framework list stabilizing.
RR-03,Delivery Quality,Client UAT delays,"Client team not performing end-to-end UAT and providing feedback of the whole portal. Partial or delayed UAT means bugs discovered late, impacting go-live readiness.",Client does not complete UAT within agreed window,Active,7,8,56,Yes,Structured UAT plan with checklist per module. Weekly UAT progress tracking. Escalate in steerco if UAT stalls.,Included in sprint,Samarth Paul (PM),2026-04-15,Samarth Paul,2026-05-20,Carried forward. Probability increased - UAT has been slow.
RR-04,Resources,PM managing multiple projects,"PM manages 4 active projects (Prime Rural, Pradan Pragati, Samarth Agri, MFIN Radar). This limits dedicated focus time for stakeholder engagement and document management. Mitigated via AI-assisted project management and living docs.",During delivery milestones requiring intensive client coordination,Active,6,7,42,Yes,"Leverage AI-assisted project management (Claude Code), maintain living heartbeat docs, prioritize weekly client syncs for Prime Rural.",Minimal,Samarth Paul (PM),2026-05-20,Samarth Paul,2026-05-20,Bandwidth concern across portfolio.
RR-05,Delivery Timeline,Go-live date undefined,"No formal go-live date has been committed. Without a target date, there is no forcing function for UAT completion, training, or deployment preparation. Multiple open questions (13+) remain unresolved.",PM unable to confirm go-live date after repeated asks,Active,7,8,56,Yes,Escalate in steerco. Request client to commit a go-live target. Work backwards from target to set UAT and training milestones.,None,Samarth Paul (PM),2026-05-20,Samarth Paul,2026-05-20,New risk. Critical for project planning.
RR-06,Technical,Mobile app offline sync complexity,"Flutter offline-first app must work reliably in low-connectivity rural Meghalaya (80 fellows across all blocks). Sync conflicts, data loss, or slow sync could cripple field adoption.",Fellow enters data offline and sync fails or produces duplicates on reconnection,Active,6,8,48,Yes,Thorough offline sync testing on slow connections. Conflict resolution strategy documented. Pilot with 5-10 fellows before full rollout.,Testing effort,Samarth Paul (PM),2026-05-20,Engineering,2026-05-20,New risk. Critical for field adoption.
RR-07,Stakeholder Engagement,Client asset dependencies blocking progress,"13+ open items pending from client: BPC HTML, EPR spec, framework task lists, logo/carousel assets, Infrastructure and Funding module specs. Each blocks specific development or documentation.",Client does not provide assets within 2 weeks of request,Active,6,7,42,Yes,Track all pending items in shared tracker. Raise in weekly sync. Escalate blockers older than 2 weeks to steerco.,None,Samarth Paul (PM),2026-05-20,Samarth Paul,2026-05-20,New risk. 13 items pending per heartbeat.
RR-08,Leadership,Steerco cadence at risk,Steerco was established and first one conducted (8 Apr 2026). Monthly cadence needed for implementation project but second steerco not yet scheduled.,More than 6 weeks pass between steercos,Active,4,6,24,Yes,Schedule next steerco immediately. Set recurring calendar invite for monthly cadence.,None,Samarth Paul (PM),2026-05-20,Samarth Paul,2026-05-20,First steerco was successful. Must maintain momentum.
